{
  "archatlas": "0.1",
  "meta": {
    "type": "G4",
    "title": "G4 · Prompt/model configuration — promotion gates",
    "lang": "en",
    "state": "to-be",
    "audience": "architects and reviewers",
    "description": "Fictional teaching design; scenario.json version 2; illustrative assumptions, not a deployed system"
  },
  "layout": {
    "template": "nested"
  },
  "nodes": [
    {
      "id": "DS-eval",
      "kind": "store",
      "label": "Evaluation datasets",
      "style": "peer",
      "sub": "Versioned prompt / model / dataset"
    },
    {
      "id": "C-eval",
      "kind": "container",
      "label": "Evaluation Job",
      "style": "primary",
      "sub": "Evaluation-only identity · No production tool writes"
    },
    {
      "id": "G4-gate",
      "kind": "task",
      "label": "Quality / safety gate",
      "style": "peer",
      "sub": "p95 ≤8s · cost ≤$0.02 · quality ≥0.85 · safety =0"
    },
    {
      "id": "G4-hold",
      "kind": "task",
      "label": "Hold candidate",
      "style": "peer",
      "sub": ""
    },
    {
      "id": "G4-release",
      "kind": "task",
      "label": "Approve digest release",
      "style": "peer",
      "sub": "Steward A / operator R"
    },
    {
      "id": "C-agent",
      "kind": "container",
      "label": "Agent Service",
      "style": "peer",
      "sub": "Production target"
    },
    {
      "id": "AWS-ops",
      "kind": "component",
      "label": "CloudWatch · KMS · Secrets",
      "style": "peer",
      "sub": "CloudWatch health / token cost"
    },
    {
      "id": "G4-recover",
      "kind": "task",
      "label": "Recovery decision",
      "style": "peer",
      "sub": "Stop canary / restore pointer"
    }
  ],
  "edges": [
    {
      "id": "DEL-1",
      "from": "DS-eval",
      "to": "C-eval",
      "label": "Candidate versions",
      "kind": "data"
    },
    {
      "id": "DEL-2",
      "from": "C-eval",
      "to": "G4-gate",
      "label": "Evaluation result",
      "kind": "data"
    },
    {
      "id": "DEL-3",
      "from": "G4-gate",
      "to": "G4-hold",
      "label": "[failed gate]",
      "kind": "dependency",
      "dashed": true
    },
    {
      "id": "DEL-4",
      "from": "G4-gate",
      "to": "G4-release",
      "label": "[all gates pass] dependency",
      "kind": "dependency",
      "dashed": true
    },
    {
      "id": "DEL-5",
      "from": "G4-release",
      "to": "C-agent",
      "label": "Promote same version",
      "kind": "data"
    },
    {
      "id": "DEL-6",
      "from": "C-agent",
      "to": "AWS-ops",
      "label": "Health signals",
      "kind": "data"
    },
    {
      "id": "DEL-7",
      "from": "AWS-ops",
      "to": "G4-recover",
      "label": "Unhealthy",
      "kind": "dependency",
      "dashed": true
    }
  ],
  "groups": []
}
