{
  "archatlas": "0.1",
  "meta": {
    "type": "G4",
    "title": "Online shop: delivery pipeline",
    "lang": "en",
    "audience": "developers and operations",
    "state": "as-is"
  },
  "layout": {
    "template": "tree",
    "profile": "doc"
  },
  "nodes": [
    {
      "id": "trg",
      "kind": "event",
      "label": "Merge to main",
      "size_hint": {
        "width": 100
      }
    },
    {
      "id": "bld",
      "kind": "task",
      "label": "Build",
      "size_hint": {
        "width": 150
      }
    },
    {
      "id": "tst",
      "kind": "task",
      "label": "Test",
      "size_hint": {
        "width": 150
      }
    },
    {
      "id": "reg",
      "kind": "store",
      "label": "Image registry",
      "size_hint": {
        "width": 150
      }
    },
    {
      "id": "dep",
      "kind": "task",
      "label": "Deploy",
      "size_hint": {
        "width": 150
      }
    }
  ],
  "edges": [
    {
      "from": "trg",
      "to": "bld"
    },
    {
      "from": "bld",
      "to": "tst",
      "label": "tests",
      "kind": "dependency"
    },
    {
      "from": "bld",
      "to": "reg",
      "label": "image",
      "kind": "data"
    },
    {
      "from": "tst",
      "to": "dep"
    },
    {
      "from": "reg",
      "to": "dep",
      "label": "pull",
      "kind": "call"
    }
  ]
}
